### ISSUE TITLE
Grizzly stores remainder of malformed methods (GET with body), exposes it to other clients and breaks other client's requests

### ISSUE THREAD

**Issue by glassfishrobot** [eclipse-ee4j/glassfish-grizzly#1672]
```
**INCOMING MALFORMED REQUEST**No.     Time        SourceDestination           Protocol Length Info
  38995 101.670866  70.166.76.194         72.214.112.209        HTTP     875    GET /appsuite/api/system?action=ping&timestamp=1395065531370&session=a922be00a4e0463b898e20b974eb54f7 HTTP/1.1  (application/x-www-form-urlencoded)

Frame 38995: 875 bytes on wire (7000 bits), 875 bytes captured (7000 bits)
Linux cooked capture
Internet Protocol Version 4, Src: 70.166.76.194 (70.166.76.194), Dst: 72.214.112.209 (72.214.112.209)
    Version: 4
    Header length: 20 bytes
    Differentiated Services Field: 0x00 (DSCP 0x00: Default; ECN: 0x00: Not-ECT (Not ECN-Capable Transport))
    Total Length: 859
    Identification: 0x0072 (114)
    Flags: 0x02 (Don't Fragment)
    Fragment offset: 0
    Time to live: 124
    Protocol: TCP (6)
    Header checksum: 0xae1b [correct]
    Source: 70.166.76.194 (70.166.76.194)
    Destination: 72.214.112.209 (72.214.112.209)
    [Source GeoIP: Unknown]
    [Destination GeoIP: Unknown]
Transmission Control Protocol, Src Port: 14120 (14120), Dst Port: http (80), Seq: 3810, Ack: 4816, Len: 819
    Source port: 14120 (14120)
    Destination port: http (80)
    [Stream index: 2156]
    Sequence number: 3810    (relative sequence number)
    [Next sequence number: 4629    (relative sequence number)]
    Acknowledgment number: 4816    (relative ack number)
    Header length: 20 bytes
    Flags: 0x018 (PSH, ACK)
    Window size value: 65197
    [Calculated window size: 65197]
    [Window size scaling factor: -2 (no window scaling used)]
    Checksum: 0xd6ea [validation disabled]
    [SEQ/ACK analysis]
Hypertext Transfer Protocol
    GET /appsuite/api/system?action=ping&timestamp=1395065531370&session=a922be00a4e0463b898e20b974eb54f7 HTTP/1.1\r\n
    Content-Type: application/x-www-form-urlencoded\r\n
    Referer: http://<HOST:PORT>/appsuite/\r\n
    User-Agent: Mozilla/5.0 (Windows NT 5.2; rv:26.0) Gecko/20100101 Firefox/26.0\r\n
    Accept-Encoding: gzip, deflate\r\n
    Accept-Language: en-US,en;q=0.5\r\n
    Accept: */*\r\n
    Connection: Keep-Alive\r\n
    Host: <HOST>\r\n
    [truncated] Cookie: JSESSIONID=6551900321752573532.APP1; open-xchange-secret-UWkBBWsipFNH8WPOmzZgQ=58effd2e05dc4fd499b3a3cf63fe1845; open-xchange-public-session-6c251df53c5523f073aaee904f015b31=73a2937a422a4a708c6a12274f158305; open-xchang
    Content-Length: 76\r\n
    \r\n
    [Full request URI: http://<HOST:PORT>/appsuite/api/system?action=ping&timestamp=1395065531370&session=a922be00a4e0463b898e20b974eb54f7]
    [HTTP request 3/3]
    [Prev request in frame: 38952]
    [Response in frame: 39000]
Line-based text data: application/x-www-form-urlencoded
    action=ping&timestamp=1395065531370&session=a922be00a4e0463b898e20b974eb54f7

No.     Time        SourceDestination           Protocol Length Info
  38996 101.671178  127.0.0.1             127.0.0.1             HTTP     990    GET /ajax/system?action=ping&timestamp=1395065531370&session=a922be00a4e0463b898e20b974eb54f7 HTTP/1.1  (application/x-www-form-urlencoded)

Frame 38996: 990 bytes on wire (7920 bits), 990 bytes captured (7920 bits)
Linux cooked capture
Internet Protocol Version 4, Src: 127.0.0.1 (127.0.0.1), Dst: 127.0.0.1 (127.0.0.1)
    Version: 4
    Header length: 20 bytes
    Differentiated Services Field: 0x00 (DSCP 0x00: Default; ECN: 0x00: Not-ECT (Not ECN-Capable Transport))
    Total Length: 974
    Identification: 0x21cb (8651)
    Flags: 0x02 (Don't Fragment)
    Fragment offset: 0
    Time to live: 64
    Protocol: TCP (6)
    Header checksum: 0x175d [correct]
    Source: 127.0.0.1 (127.0.0.1)
    Destination: 127.0.0.1 (127.0.0.1)
    [Source GeoIP: Unknown]
    [Destination GeoIP: Unknown]
Transmission Control Protocol, Src Port: 34601 (34601), Dst Port: 8009 (8009), Seq: 3633, Ack: 4232, Len: 922
    Source port: 34601 (34601)
    Destination port: 8009 (8009)
    [Stream index: 2143]
    Sequence number: 3633    (relative sequence number)
    [Next sequence number: 4555    (relative sequence number)]
    Acknowledgment number: 4232    (relative ack number)
    Header length: 32 bytes
    Flags: 0x018 (PSH, ACK)
    Window size value: 384
    [Calculated window size: 49152]
    [Window size scaling factor: 128]
    Checksum: 0x01c3 [validation disabled]
    Options: (12 bytes), No-Operation (NOP), No-Operation (NOP), Timestamps
    [SEQ/ACK analysis]
Hypertext Transfer Protocol
    GET /ajax/system?action=ping&timestamp=1395065531370&session=a922be00a4e0463b898e20b974eb54f7 HTTP/1.1\r\n
    Host: <HOST>\r\n
    Content-Type: application/x-www-form-urlencoded\r\n
    Referer: http://<HOST:PORT>/appsuite/\r\n
    User-Agent: Mozilla/5.0 (Windows NT 5.2; rv:26.0) Gecko/20100101 Firefox/26.0\r\n
    Accept-Encoding: gzip, deflate\r\n
    Accept-Language: en-US,en;q=0.5\r\n
    Accept: */*\r\n
    [truncated] Cookie: JSESSIONID=6551900321752573532.APP1; open-xchange-secret-UWkBBWsipFNH8WPOmzZgQ=58effd2e05dc4fd499b3a3cf63fe1845; open-xchange-public-session-6c251df53c5523f073aaee904f015b31=73a2937a422a4a708c6a12274f158305; open-xchang
    X-Forwarded-For: 70.166.76.194\r\n
    X-Forwarded-Host: <HOST>\r\n
    X-Forwarded-Server: 172.18.75.16\r\n
    Connection: Keep-Alive\r\n
    Content-Length: 76\r\n
    \r\n
    [Full request URI: http://<HOST:PORT>/ajax/system?action=ping&timestamp=1395065531370&session=a922be00a4e0463b898e20b974eb54f7]
    [HTTP request 3/4]
    [Prev request in frame: 38955]
    [Response in frame: 38999]
    [Next request in frame: 39067]
Line-based text data: application/x-www-form-urlencoded
    action=ping&timestamp=1395065531370&session=a922be00a4e0463b898e20b974eb54f7
```
```
**OUTGOING RESPONSE WITH PROBABLY SENSITIVE DATA**
No.     Time        SourceDestination           Protocol Length Info
  39089 101.747447  127.0.0.1             127.0.0.1             HTTP     528    HTTP/1.1 501 Method action=ping&amp;timestamp=1395065531370&amp;session=a922be00a4e0463b898e20b974eb54f7PUT is not defined in RFC 2068 and is not supported by the Servlet API  

Frame 39089: 528 bytes on wire (4224 bits), 528 bytes captured (4224 bits)
Linux cooked capture
Internet Protocol Version 4, Src: 127.0.0.1 (127.0.0.1), Dst: 127.0.0.1 (127.0.0.1)
    Version: 4
    Header length: 20 bytes
    Differentiated Services Field: 0x00 (DSCP 0x00: Default; ECN: 0x00: Not-ECT (Not ECN-Capable Transport))
    Total Length: 512
    Identification: 0xd291 (53905)
    Flags: 0x02 (Don't Fragment)
    Fragment offset: 0
    Time to live: 64
    Protocol: TCP (6)
    Header checksum: 0x6864 [correct]
    Source: 127.0.0.1 (127.0.0.1)
    Destination: 127.0.0.1 (127.0.0.1)
    [Source GeoIP: Unknown]
    [Destination GeoIP: Unknown]
Transmission Control Protocol, Src Port: 8009 (8009), Dst Port: 34601 (34601), Seq: 4527, Ack: 5940, Len: 460
    Source port: 8009 (8009)
    Destination port: 34601 (34601)
    [Stream index: 2143]
    Sequence number: 4527    (relative sequence number)
    [Next sequence number: 4987    (relative sequence number)]
    Acknowledgment number: 5940    (relative ack number)
    Header length: 32 bytes
    Flags: 0x018 (PSH, ACK)
    Window size value: 400
    [Calculated window size: 51200]
    [Window size scaling factor: 128]
    Checksum: 0xfff4 [validation disabled]
    Options: (12 bytes), No-Operation (NOP), No-Operation (NOP), Timestamps
    [SEQ/ACK analysis]
Hypertext Transfer Protocol
    HTTP/1.1 501 Method action=ping&amp;timestamp=1395065531370&amp;session=a922be00a4e0463b898e20b974eb54f7PUT is not defined in RFC 2068 and is not supported by the Servlet API \r\n
    Server: grizzly/2.2.22\r\n
    Expires: Sat, 06 May 1995 12:00:00 GMT\r\n
    Cache-Control: no-store, no-cache, must-revalidate, post-check=0, pre-check=0\r\n
    Pragma: no-cache\r\n
    Content-Type: text/javascript;charset=UTF-8\r\n
    Date: Mon, 07 Apr 2014 13:58:35 GMT\r\n
    Connection: close\r\n
    Content-Length: 0\r\n
    \r\n
    [HTTP response 4/4]
    [Time since request: 0.007504000 seconds]
    [Prev request in frame: 38996]
    [Prev response in frame: 38999]
    [Request in frame: 39067]

No.     Time        SourceDestination           Protocol Length Info
  39092 101.747629  172.18.75.16          172.18.75.1           HTTP     528    HTTP/1.1 501 Method action=ping&amp;timestamp=1395065531370&amp;session=a922be00a4e0463b898e20b974eb54f7PUT is not defined in RFC 2068 and is not supported by the Servlet API  

Frame 39092: 528 bytes on wire (4224 bits), 528 bytes captured (4224 bits)
Linux cooked capture
Internet Protocol Version 4, Src: 172.18.75.16 (172.18.75.16), Dst: 172.18.75.1 (172.18.75.1)
    Version: 4
    Header length: 20 bytes
    Differentiated Services Field: 0x00 (DSCP 0x00: Default; ECN: 0x00: Not-ECT (Not ECN-Capable Transport))
    Total Length: 512
    Identification: 0xe985 (59781)
    Flags: 0x02 (Don't Fragment)
    Fragment offset: 0
    Time to live: 64
    Protocol: TCP (6)
    Header checksum: 0x613c [correct]
    Source: 172.18.75.16 (172.18.75.16)
    Destination: 172.18.75.1 (172.18.75.1)
    [Source GeoIP: Unknown]
    [Destination GeoIP: Unknown]
Transmission Control Protocol, Src Port: http (80), Dst Port: 55687 (55687), Seq: 25148, Ack: 10225, Len: 460
    Source port: http (80)
    Destination port: 55687 (55687)
    [Stream index: 1949]
    Sequence number: 25148    (relative sequence number)
    [Next sequence number: 25608    (relative sequence number)]
    Acknowledgment number: 10225    (relative ack number)
    Header length: 32 bytes
    Flags: 0x018 (PSH, ACK)
    Window size value: 295
    [Calculated window size: 37760]
    [Window size scaling factor: 128]
    Checksum: 0xf028 [validation disabled]
    Options: (12 bytes), No-Operation (NOP), No-Operation (NOP), Timestamps
    [SEQ/ACK analysis]
Hypertext Transfer Protocol
    HTTP/1.1 501 Method action=ping&amp;timestamp=1395065531370&amp;session=a922be00a4e0463b898e20b974eb54f7PUT is not defined in RFC 2068 and is not supported by the Servlet API \r\n
    Date: Mon, 07 Apr 2014 13:58:35 GMT\r\n
    Server: grizzly/2.2.22\r\n
    Expires: Sat, 06 May 1995 12:00:00 GMT\r\n
    Cache-Control: no-store, no-cache, must-revalidate, post-check=0, pre-check=0\r\n
    Pragma: no-cache\r\n
    Content-Type: text/javascript;charset=UTF-8\r\n
    Content-Length: 0\r\n
    Connection: close\r\n
    \r\n
    [HTTP response 12/12]
    [Time since request: 0.008105000 seconds]
    [Prev request in frame: 38883]
    [Prev response in frame: 38889]
    [Request in frame: 39062]
```

*   As shown above client1 sends a malformed get with body = action=ping&timestamp=1395065531370&session=a922be00a4e0463b898e20b974eb54f7
*   Grizzly reads the request, finds a GET Method that doesn't expect further content in org.glassfish.grizzly.http.HttpServerFilter.prepareRequest(ServerHttpRequestImpl, boolean)
*   The body of the GET is then returned via return ctx.getInvokeAction(input) in org.glassfish.grizzly.http.HttpCodecFilter.handleRead(FilterChainContext, HttpPacketParsing) and finally stored via org.glassfish.grizzly.filterchain.DefaultFilterChain.storeMessage(FilterChainContext, FiltersState, FILTER_STATE_TYPE, int, M, Appender<M>)
*   The remainder is then prepended to one of the next requests causing an error while parsing the initial request line action=ping&timestamp=1395065531370&session=a922be00a4e0463b898e20b974eb54f7PUT ,probably exposing confidential data to other clients and breaking request of other clients.

We are currently testing a fix that silently discards the remainder by replacing it with an empty buffer for messages that shouldn't expect more content.

This fix can be seen at [https://github.com/dermarens/grizzly-mirror/commit/b8c8d6723d07c34fd454cf40fad5fc7927e40b46](https://github.com/dermarens/grizzly-mirror/commit/b8c8d6723d07c34fd454cf40fad5fc7927e40b46)

This is similar to #1666 but we can't simply switch to 2.3.x. Furthermore i'd prefer to simply discard the body of the GET instead of responding with an error as bodies aren't forbidden according to the spec:

Roy T. Fielding (one of the principal authors of the HTTP specification) [https://groups.yahoo.com/neo/groups/rest-discuss/conversations/topics/9962](https://groups.yahoo.com/neo/groups/rest-discuss/conversations/topics/9962)

"Yes. In other words, any HTTP request message is allowed to contain
a message body, and thus must parse messages with that in mind.
Server semantics for GET, however, are restricted such that a body,
if any, has no semantic meaning to the request. The requirements
on parsing are separate from the requirements on method semantics.

So, yes, you can send a body with GET, and no, it is never useful
to do so.

This is part of the layered design of HTTP/1.1 that will become
clear again once the spec is partitioned (work in progress)."

Apache doesn't throw an error either but simply forwards the request to us.
#### Environment
Adapted grizzly-2.2.x as part of [http://oxpedia.org/wiki/index.php?title=AppSuite:Grizzly](http://oxpedia.org/wiki/index.php?title=AppSuite:Grizzly)
#### Affected Versions
[2.2.22]

**Comment by glassfishrobot** [comment]
@glassfishrobot Commented 
Reported by marens

**Comment by glassfishrobot** [comment]
@glassfishrobot Commented 
Issue-Links:
is related to
[GRIZZLY-1666](https://github.com/javaee/grizzly/issues/1666)

**Comment by glassfishrobot** [comment]
@glassfishrobot Commented 
Was assigned to oleksiys

**Comment by glassfishrobot** [comment]
@glassfishrobot Commented 
oleksiys said:
just for the records, this issue looks similar to #1666, but is related to Grizzly 2.2.x.
Marc, can you pls. try the latest 2.2.22-SNAPSHOT?

Thanks.

**Comment by glassfishrobot** [comment]
@glassfishrobot Commented 
marens said:
Hello Alexey,

i merged your fix and it's currently working fine. Will report back if further tests show any problems.

Thanks a lot for your fast response.

Marc

**Comment by glassfishrobot** [comment]
@glassfishrobot Commented 
oleksiys said:
Thank you Marc,

I'll wait a little bit more for you feedback before making the release.

**Comment by glassfishrobot** [comment]
@glassfishrobot Commented 
marens said:
We are already using it on our internal systems and automated tests are looking good.

**Comment by glassfishrobot** [comment]
@glassfishrobot Commented 
@rlubke said:
Duplicate of #1666.

**Comment by glassfishrobot** [comment]
@glassfishrobot Commented 
Marked as **duplicate** on Friday, October 16th 2015, 1:58:25 pm

**Comment by glassfishrobot** [comment]
@glassfishrobot Commented 
This issue was imported from java.net JIRA GRIZZLY-1672

**Comment by glassfishrobot** [comment]
* **Issue Imported From:** https://github.com/javaee/grizzly/issues/1672
* **Original Issue Raised By:**@glassfishrobot
* **Original Issue  Assigned To:** @glassfishrobot
* **Original Issue  Closed By:**@glassfishrobot
